264183816548130816	15140428	positive	Gas by my house hit $3.39!!!! I'm going to Chapel Hill on Sat. :)
264249301910310912	18516728	negative	Iranian general says Israel's Iron Dome can't deal with their missiles (keep talking like that and we may end up finding out)
264105751826538497	147088367	positive	with J Davlar 11th. Main rivals are team Poland. Hopefully we an make it a successful end to a tough week of training tomorrow.
264094586689953794	332474633	negative	Talking about ACT's && SAT's, deciding where I want to go to college, applying to colleges and everything about college stresses me out.
254941790757601280	557103111	negative	They may have a SuperBowl in Dallas, but Dallas ain't winning a SuperBowl. Not with that quarterback and owner. @S4NYC @RasmussenPoll
264169034155696130	382403760	neutral	Im bringing the monster load of candy tomorrow, I just hope it doesn't get all squiched
263192091700654080	344222239	objective-OR-neutral	Apple software, retail chiefs out in overhaul: SAN FRANCISCO Apple Inc CEO Tim Cook on Monday replaced the heads... bit.ly/XQEhJU
263398998675693568	812957996	positive	@oluoch @victor_otti @kunjand I just watched it! Sridevi's comeback.... U remember her from the 90s?? Sun mornings on NTA ;)
260200142420992000	332530284	objective	#Livewire Nadal confirmed for Mexican Open in February: Rafael Nadal is set to play at the Me... bit.ly/WY4Vjy #LiveWireAthletics
264087629237202944	61903760	positive	@MsSheLahY I didnt want to just pop up... but yep we have chapel hill next wednesday you should come.. and shes great ill tell her you asked
250692636330049538	29023839	neutral	@Alyoup005 @addicted2haley hmmmm November is an odd release date if true but if it becomes big enough maybe she could sing it at Grammys
263304719471087617	564843841	objective	#Iran US delisting MKO from global terrorists list in line with Iran campaign: Tehran, Oct 30, IRNA -- Secretary... bit.ly/XSTGtd
263956867787673600	183985016	positive	Good Morning Becky ! Thursday is going to be Fantastic ! @SwedenG @DJ4JG @Grdina @Paverlayer @FSBull @RevkahJC @DicksTrash @borderfox116
263975113404342273	616166780	objective	Expect light-moderate rains over E. Visayas; Cebu, Bohol, Samar & Leyte have 30-70% chance of rains tonight! Expect fair weather tomorrow!:)
257343699460173824	10115042	positive	One ticket left for the @49ers game tomorrow! Don't miss the rematch of the NFC Championship game against the NY Giants! Hit me up!
264125591337463808	348691527	negative	AFC away fans on Saturday. All this stuff about the 'she said no' chant. It's bollocks. When he has the ball, just turn your back on him.
264259830590603264	183011479	negative	Why is it so hard to find the @TVGuideMagazine these days? Went to 3 stores for the Castle cover issue. NONE. Will search again tomorrow...
264223934403211264	117204603	neutral	@TrevorJavier the heat game may cost alot more...and plus I would rather see Austin Rivers play
264041764460036096	198706982	positive	Never start working on your dreams and goals tomorrow......tomorrow never comes....if it means anything to U, ACT NOW! #getafterit
264102295392882689	43577828	positive	@TheFFAddict I had Vick and Flacco, needed an upgrade. Vick may get benched, Jennings a back up again soon. I thought it was a win for me.
264071572925603841	43167117	positive	Looks like Andy the Android may have had a little too much fun yesterday. instagr.am/p/Rfzo6FInsj/
262115068320284672	306647135	positive	@APGPhoto oooh nice .. Tis tempting to go up the lakes with my Nikon ... Hmmmm I may do that ..
264239636799430656	864992245	objective-OR-neutral	BLACK FRIDAY Huge Saving Aerial View of a City, Paris Las Vegas, the Las Vegas Strip, Las Vegas,... prlasvegas.outdoorkitchennarm.com/black-friday-h…
257951107530252289	100101797	negative	@MelmurMel @PBandJenelley_1 @vl_delp_ham_ Jenelle lies,1st she said she was alone &the hosp.now she's saying how weird it was for Keiffer's
263502599699955712	138301329	negative	@MyBeautyisBrown LMFAO his big ass get on my nerves, you going to class tomorrow?
236665189502681089	551910244	objective	Mohamed Morsi, Egypt's Muslim Brotherhood president, instructed the Supreme Council of the Armed Forces Thursday... fb.me/1AIvanLJZ
262384414623936512	17091853	neutral	C'mon Avila! You just got tagged out by a guy who looks like the kid Bill Murray was researching in The Royal Tenenbaums! #Tigers
263936581734383617	108594490	negative	@thehuwdavies you think the Boro will beat Swansea? I'm not so sure, December/January is when we implode
249228128302551040	160639448	objective-OR-neutral	At the first Grammy Awards, held on 4 May 1959, Domenico Modugno beat out Frank Sinatra and Peggy Lee for the Record of the Year,with Volare
263346444772184065	566521127	positive	@JennetteMcHevan I have studied all day but tomorrow I'm going out with friends! :D Omg Jennette did?!!!! I'm gonna look! <3
263970913270251520	15794878	positive	Good morning Thursday. "Life is fragile. We're not guaranteed a tomorrow so give it everything you've got." - Tim Cook [Do it for Jobs!]
264162997088436224	93655075	positive	#Twitition Mcfly come back to Argentina but this time we want to come to mar del plata!!! twitition.com/p9clo
259821574394355712	23346086	positive	@Astrochologist anything. I wondered how the aspects btwn my sun/moon faired with my rising. I also have Venus in Sag...yea lol Thank u :)
263800856321859584	49032667	negative	My teachers call themselves givng us candy....wasn't even the GOOD stuff. I might go to Walmart or CVS tomorrow/
264011728084410369	24144230	neutral	#Broncos Peyton Manning named AFC Offensive Player of the month. It's his 5th such honor, second to Tom Brady's 6, tied w/ TD.
264120483384008704	533302080	objective-OR-neutral	@TooZany is bringing out Kendrick Lamar the 6th of December!?! Get your tickets now!
263939499426476032	37877566	positive	@jackseymour11 I may have an Android phone by the time I get back to school! :)
264056733691961345	23939440	objective-OR-neutral	Andre's Wigan Warning - #COYS Official Site Wigan might currently occupy 15th place in the Premier League,... tmblr.co/ZiAjGyWOM57G
261965816906534912	345065738	objective-OR-neutral	@juice005 strange enough, I'm going to see Noel Gallagher in concert tomorrow night. #alldayb1tch
263656013541027840	913170146	objective-OR-neutral	How are they going to act in new york with the subways out? They better clutch it out like Eli Manning 4th quarter
165044172858986496	160465887	negative	Homegrown talent missing on Signing Day: Throughout most of the day on Wednesday, the video scoreboard ... bit.ly/ztNRG0 #Raleigh
264230416897159168	142476472	positive	taylor swift is coming with ed sheeran june 29th? most perf news i've heard all night.
263809311086628864	175523498	positive	The great Noel Gallagher is about to hit the stage in St. Paul. Plenty of room here so we're 4th row center. Plenty of room. Pretty fired up
263797084673691648	372303578	objective	@lala_cox There are going to be plenty of ups & downs for Boro,Cardiff,Leicester etc until May.I hope we are still in with a shout for promo
264162375182217217	299885545	negative	@joeeewilliams that sucks, amazon might have some left .. hate that i won't have it until 11am on Tuesday though
264253780797825026	201148169	neutral	Playing as the Browns HC K. Fri in #Madden13, XFacalac lost to the Ravens 21-28 on All-Madden #ConnectedCareers
260193762398064640	33442620	negative	@rosanne_89 Nooooooooo rosanne! They've just restocked them and me going overseas Sunday means I can't afford them :'(
256237809147445248	478075690	neutral	The pain is far deeper than a Billy cundiff missed field goal. Gotta wake up and forget about it tomorrow. #Orioles #stayhungry
264198711113039872	113783053	positive	@grandvincenzo on November 16 be ready to head to the movies. Breaking Dawn: Part 2. (;
262977065568051201	73767786	objective-OR-neutral	after seeing @Iam_FaithReid's tweet about watching The Vow, I think I may need to watch it.
262068536187432960	90333241	positive	@jbmclendon And the same station that will air new episodes of COUGAR TOWN in January! @tbsveryfunny has been good to us, Jordan. #PennyCan
264215390773727232	276151090	objective	Alex Poythress had 11 points and 7 rebounds in his debut with Kentucky during an exhibition game on Thursday. He played 28 minutes.
245461530206932992	222961982	positive	I think I may have a heart attack for Jason Wu's new collection. So Charlotte Rampling in the Night pinterest.com/pin/6889106927…
263391524769898496	615354091	neutral	If I can get my equipment working correctly we will have a live show on Friday at 6 pm CST with contactee Ray... fb.me/1NKnb6ZhU
260248287255343104	407729607	positive	Amazing concert tonight with Jim White and the TCU Jazz Ensemble/Faculty Jazz Combo! Don't miss tomorrow night... fb.me/25EQZW3B0
256984347935141889	62265830	neutral	#Nationals 9th Inning had that "4th Quarter #Redskins" feel, didn't it? Coulda swore I saw Cundiff shank one from the mound.
256416307182985217	47208627	positive	Capello says time for Russia to win big match: Russia manager Fabio Capello on Thursday said that he intended to... bit.ly/Q1z5MC
259452211883569152	63808899	neutral	JACKALS GOAL! Jimmy Martin sneaks a rebound past Killeen to give Elmira a 2-1 lead. Bushee & Bellamy with the assists.1:09 left 2nd period
263732569508552704	369152026	positive	Kick-off your weekend with service! EV!'s Get on the Bus trip to the Boys & Girls Club is Friday from 3-6! Hope to see you there :)
264222052129574912	430519387	positive	@nater0driguez Lmfao alright u got me there. Good job Parker and the spurs, see y'all jan 9th. If I get an extra ticket to that game ur goin
213342054351257601	189656827	negative	Desperation Day (February 13th) the most well known day in all mens life.
255190216795639808	366751482	objective	@SunnyClifford We have a similar circumstance in Australia. Jan 25 is Australia Day & many First peoples call it Invasion Day.
264135339327766529	159343219	objective-OR-neutral	paul-and5homos: Harry and Louis are just fri- Eleanor is such an inspira- Harry is such a manwho- Louis is... tmblr.co/ZFia7xWPV8yE
263079812954992640	392639346	neutral	#web Apple software, retail chiefs out in overhaul: SAN FRANCISCO (Reuters) - Apple Inc CEO Tim Cook on Monday replaced the heads of ...
264088457490604032	509707361	negative	"@PaperChasinAL: Damn next Saturday tho" Niggas was trynna get shit over with #early
263132960507703296	449609540	objective-OR-neutral	and the 4th one is for Harry Styles!! <33333
259022549604790273	204793455	objective	Blog Post: MTV's "Teen Mom 2" Returns for an Intense Third Season with Chelsea, Jenelle, Kailyn and Leah on Monday,... dlvr.it/2LLcQV
253050608322502657	200261099	objective	The Business Leader's Award ceremony will be held during the @wef annual meeting in Davos on the 25 January 2013! endhumantraffickingnow.com/?portfolio=bus…
263919760503361536	87970697	positive	Hoping to look FIT tomorrow on the Jeremy Kyle show #ITVFashion
264203403473850368	853146211	objective-OR-neutral	@Jordon_Atkins me you and joe gone chill Saturday of i come tho
264242024453111809	45450902	negative	"Obma fails 2unite us, he divides us by sex, color,party,age, wealth Nevada's 1st Latino governor votes early for Romney, predicts GOP win"
256787668367704066	610413207	positive	Grammys concert pays moving tribute to Whitney Houston: Whitney Houston was given a final sendoff by the Grammys on Thursday as Halle...
263865575313383424	410051441	neutral	We tallied up the votes and are announcing the winners for Calling All Communities! Tune in uscellular.com on Nov 1st at 11am (CST)
259224351478521856	20050520	objective-OR-neutral	It's Radio 1 Rocks next - week starting off with a Live lounge on @fearnecotton's show with Bullet for my Valentine on Monday
246760239221858306	7532872	positive	Drew Peterson is #Untouchable no more! Check out these movie photos before you watch on Sun at 7/6c: bit.ly/QZkoK1
262862262270820352	601803511	neutral	@HotspurRelated im just a 19 year old still on loan for the 3rd time at coventry 79 overall hopefully when i return bale will still be ther
264084352340742145	388974334	positive	PUMPED to open the season tomorrow night against Georgetown! Women's Preview: bit.ly/QXekV7 | Men's Preview: bit.ly/QXemfI
264160761117552640	32215290	negative	Just found a piece of candy that may have been injected with something. #Why
263319006063259649	432174507	objective-OR-neutral	Apple shakeup Mobile software boss eased out: Apple Inc. CEO Tim Cook on Monday pushed out the powerful head of the company&#039;s mo...
263799123847806976	22100843	neutral	Somehow I managed to "lose" my princess leia bra on Saturday. I'm going to Noel Gallagher as "Glock at Phish" ie jorts&tank. @custymcnoob
263924763423035392	27133567	neutral	@docbungle I may relent and get one myself, but I hope it doesn't come to that. Hopefully all the decent apps will get ported to android
264183514176552961	316127177	neutral	Android 4.2 Camera app with Photo Sphere now available for Galaxy Nexus: Introduced on Monday, Android 4.2 bring... bit.ly/TffDi7
262575945741914113	31121565	positive	SAEED: #NowPlaying: BEP, Ricky Martin and KT Tunstall! Great songs to get you through your Sunday! Hate the rain!! boltonfm.com/listen-live
263921038352580608	213263464	neutral	@juliecrawley25. @GininjaDesign. @Donna_Butlin. Nope, it's just Camden, eating Greek food with a pumpkin... Just another Wednesday.
263748118091276288	785067278	objective	FAQ: What is 'skeuomorphic design' and the executive shakeup at Apple: SAN FRANCISCO, CA - MARCH 07: Apple CEO ... bit.ly/T89gNo
263651627372777473	19594426	objective	Fact of the day; Halloween night is Papa John's second busiest night of the year behind Super Bowl Sunday.
257369508086423553	531994655	positive	Omg. Ricky Martin may be gay but he is one fine ass gay man.
264249493787136000	260882576	positive	@lenakoncha the Clippers are playing the Cavaliers on Monday and are having a night to honor Israel! :) wish you were in LA STILL.
261434845773828096	391892475	negative	Noel Gallagher: "Musicians are fucking idiots." - Yeah, Brian May - he's an idiot... an idiot who just so happens to be a professor?
252798281413967872	23075654	objective-OR-neutral	Vow is likely to return from a midsummer break in the Prix de Royallieu at Longchamp on Saturday. bit.ly/V6sjMm
264182638816919552	446301191	positive	@HOPE_forHippies Hell yea lmfaoo , & see you tomorrow Asia baby (;
264138191030874112	850357831	neutral	@Real_Liam_Payne I wanted you to know that here in Argentina is going to make a directioner fest 10 November te Amo TE AMO te amo!
263864248952836096	609103932	neutral	Its November already.. Christmas will be here soon, then New Year, then Valentine's day then GRADUATION?!?!
263972222677417985	229497776	positive	#NowPlaying Michael Jackson - She's Out of My Life (Live At Wembley July 16. mjtunes.com/michael-jackso… L.O.V.E it! #MjTunes
263867263474597888	428841738	negative	Niggas be on the LAKERS DICK...we still gon finish damn near first seed...while yo team be struggling for the 8th spot
240553933116944384	533752023	positive	@RediTlhabi @StevenB7777 OCTOBER people have principles..& argue passionately for them, about them & ACT on them. Ghandi, Sadat, ADT, me!
261642731477168128	372012787	positive	@amberrblack amber fantastic news!!! We will reunite with Barbara and jenelle on November 21st when teen mom 2 premieres!!
246320271248744448	206354030	positive	I'm in the bathroom bumping "Niggas In Paris" Crunk ass hell like it's my 1st time hearing it this song will never get old lol
255690502970671104	18712398	objective	Just got tickets to see Muse in Florida. That, combined with the Grammys two weeks prior, equals a really busy February for Ruby and myself.
261632295520333826	217685779	objective	Battle for the 17th banner: Royal Rumble basketball edition
261184553337630720	244570235	positive	4th Album out #RED, #20MillionSwifties, 6 Grammy Awards, 10 AMAs, 13 BMI Awards! Reigning Entertainer of the Year ACM! #6YearsTaylorSwift
226474708487532546	59060233	objective-OR-neutral	Smooches from Fido: Yea or Nay? - July 6th was International Kissing Day (of the human sort). Later in the month, Ca... ow.ly/1lwzys
247183266782789632	260477688	positive	It's midnight on the east coast which means its @nickjonas birthday! HAPPY 20th BIRTHDAY NICK J!!!!!!!!!! <333
251742524601925633	610495100	negative	Apple CEO apologizes for error-ridden new map app: Apple CEO Tim Cook apologized Friday for the company's error-ridden new mobile map...
261706811453886464	79601816	neutral	Monta Ellis / Ellis provided just five points on 2-of-13 shooting Thursday goo.gl/fb/rh1J8 #nba #playersnews
258989036205662208	25393624	neutral	When I teach a basketball in my own school, we're gonna spend the 1st day watching Larry Bird videos, & the rest will take care of itself.
264084748345962496	747406040	objective-OR-neutral	AT&T offers free cloud storage for iOS and Android AT&T on Thursday announced a new service it calls AT&T Locker th... cnet.co/RxB7aa
263794433596723200	41680302	positive	We are here @NBCofChicago for our 12th Anniversary celebration. You still have time to make it - 6620 S. King Dr
237571817550786563	727519172	objective-OR-neutral	@KarimAndSugar I told you Shane would get his 5th-star on Rivals before Signing Day. @Taylor_McNeill7
263449315350032384	295403177	objective	@mysticvalley Mitch are you free on Sunday to bale leaves for an hour? If not no big deal you can have them for animals
252330752665075712	268248070	positive	Love how I skipped every category of the NTA's besides the soaps. Couldn't give half a fuck if everything else went off the air tomorrow.
263610933568499712	302256936	negative	@starky88 @nfl_uk Was in on sat and they only had the Ray Lewis home jersey. They didn't have a lot either.
262903244886507521	575902991	objective	New York Giants: Game-by-Game Predictions for the 2nd Half of the Season dlvr.it/2PF10l
264240983032614912	123520382	objective	C'mon c'mon does sound like Queen's we will rock you somehow...
264055660864487424	346867096	objective	Pick the Chelsea team to play Swansea - Chelsea's focus now turns back to the Premier League and on Saturday we make... ow.ly/2sZ1js
247772918384320512	19885888	neutral	@MarkUkLeaf I just had a look and it seems Nash to Davos is a done deal along with Joe Thornton. I may have to pay a visit...
254032799680589826	412603173	positive	My mom just texted me reminding me that Grammys birthdays tomorrow.. HOW COULD I EVER FORGET? #BiggestDayOfTheYear
262206571201822721	185101254	positive	@ariaclemente Wow! you're also a percy jackson fan! :-) The 4th book of Heroes of Olympus will be entitled "House of Hades" @camphalfblood
264143294903246848	331180650	negative	Esperance will be without star player Youssef Msakni for the first leg of the Champions League final against Al Ahly on Saturday. #AFRICA
263247166582173696	45671664	negative	@chrischris__ The Sun: Paolo Di Canio says beating Aston Villa tonight would be like having sex with Madonna. #legend
226238092191875072	141284401	negative	OBVIOUSLY, i am not a fan of Dream High 2 and i haven't even watched it! well, i watched the 1st ep,that's where i heard that song!^^
258887925075410944	37007849	positive	Black History Fact: Marsalis is the 1st and only artist to win both classical and jazz Grammy Awards in one year, and to repeat the next yr
263530816162902016	323297690	positive	Watching David Letterman with no audience but playing like they are still there is the 2nd most brilliant thing I've seen tonight.
246588959247974401	67771614	objective-OR-neutral	Gov. Mitch Daniels will announce his Indiana Supreme Court pick at 10 a.m. Will the 3rd time be the charm for a female member of the panel?
263753326422806528	18013192	objective-OR-neutral	Most common nights to order pizza: NYE, Jan 1, day before Thanksgiving, Super Bowl Sunday, Halloween. p-bu.mp/msp-
257865075933728771	413586409	positive	The Grey and Yellow Gold Wedding Puzzle is now up with the first piece being a unique two-tone dress by @shopbop! piecefulwedding.com/puzzle/31/Mond…
262380235985657856	40098249	objective	HARAKAH: Iran army monitoring all ships in Gulf: TEHRAN, Oct 28: A senior commander of the Islamic Revolution Gu... bit.ly/VSN8MS
263740861031010304	16380085	neutral	HT: Norwich 0-0 #Spurs. We've edged the 1st half without creating any clear cut chances. Bale's had a couple of decent long range efforts.
264226988879933440	26639468	positive	Guys, the Marijuana law in Colorado, Oregon, and Washington can pass this Tuesday. #HighHopes
254600864868749313	59459031	positive	Breezin' won the Best Pop Instrumental Performance at the 19th Grammy Awards
248234871238037508	51264823	objective	"Pacino is going to play Joe Paterno. This is the 2nd time he has starred in a film, that has the line 'say hello to my little friend"- SNL
264161130585399297	163101429	negative	Not wearing make up to Dublin tomorrow until I'm getting ready for the party. Help.
263953741877764096	341470410	neutral	Snow may fall for parts of CNY the next few days. Find out where the best chances will be at 6:42 am on TV & online: 9wsyr.com/content/mediac…
204001339599106048	160648260	neutral	Cofield draws leadoff walk in top 4th. Zaharion at the plate.
257332145687785472	328656254	objective-OR-neutral	@BieberGomezTour aww my celebrity day is this thursday also, going as Jennifer Hudson though :)
263976883354480640	497155084	objective-OR-neutral	Sat down to watch Michael Jackson this is it on DVD xx
256395784038277120	163198967	objective	On the set of the Axis of the Nigerian Economy, airing every tuesday 8:30pm on NTA international (DSTV) lockerz.com/s/252184437
261769579544584192	20096243	positive	Text from my dad: "you like Charles Dickens" 1) obvs looking at my amazon wish list (too late for Sunday) 2) why th surprise?!
264167430564237312	17781471	negative	Upset alert in ACC men's soccer: #1 Maryland down 4-2 to Wake Forest late in the 2nd...AND down a man after an earlier red card.
262627821908815872	28844188	negative	really bored of this host on Super Sunday doing nothing but talk and rave about Man Utd #BiasPrick
258836119532228608	25483231	neutral	I may have missed out seeing Noel Fielding and Rich Fulcher today, but I did just see Tom Tilley! #samsimmons
258625516481953792	134881721	positive	Looper was amazing!!! Now to the theatre to see Simon Callow's 'The Mystery of Charles Dickens' ...loving my Wednesday off work :-)
255848522581164033	363795716	objective-OR-neutral	Negros and nigglettes, all who would like to attend the a$ap rocky concert on November 17th at starland lemme know tickets are only 25
264105390818619394	812898906	positive	Wish Maddie luck next saturday, she has a solo audition for Britain's Got Talent! :) ~ Ellie xxxxx
241225651074527232	39010302	neutral	% of Joe Pa masks at Penn State Sat? Or will PSU by allow then in the stadium? Is it bad to wear it? @Espngreeny
256018140318822400	580515576	negative	@MeganWitmer that's crazy. I'm more jealous of u going to Joe Pa's grave! I was sad Saturday when I walked past where the statue should be:(
263362769011748864	27020138	positive	Mizzou commemorates its win over Kentucky with a T-shirt. No, really. | Dr. Saturday - Yahoo! Sports sports.yahoo.com/blogs/ncaaf-dr… #fb
260036217008185344	278137824	neutral	@FruitPunchToday lol that was our only year we may have had a chance at the Superbowl. Now we must wait until Nick Foley
263706155778441216	27556859	objective-OR-neutral	@Vikingdane1 Thinking a bolt action .30-06 may have to be in the cards for Valentine's Day or something.
223045564571459584	305277813	positive	Happy Valentine's Day!!! @MAziing: Everyday is the 14th!
263961750142062592	441531846	objective-OR-neutral	@xBecx92 it may be Indian time tonite Becky :-) xx
263704789186117635	38615758	positive	Just watched The Campaign with Will Ferrell and Zack Galafianakis... Good fun for a Wednesday. #Hilarious
262778055402090496	22513829	objective	@sumeetkulkarni Season ends with Superbowl in first week of February.
260799759097421824	15659445	objective-OR-neutral	@HilciaJSu Your review reminded me I still need 2 read the very 1st Percy Jackson book! Heroes of Olympus is an offshoot series from it?
260949777687117824	32704887	neutral	Crazy I was in a meeting with an old NBA player that was picked 3rd before Larry Bird
245532165637545985	34014706	negative	As an introduction to Literature we wrote about The Woman In Black, not something I particulalry want to read, may just cry #ShitMyself
264060311764619264	851106050	objective	"@Ilovedoobz: @Patty_flipping I did, the other new is in today, northern lights......" I get payed tomorrow!
264202743877615616	21069858	objective-OR-neutral	Just finished rehearsing with @DWHY - we are ready for the Kendrick Lamar show tomorrow, shout outs to WVU... pic.twitter.com/d76r8YZH
262834360129036288	800315304	objective	I posted 12 photos on Facebook in the album "Super Sunday wid Shobhit Bhatia......" fb.me/1JmuY1mc9
264215340576284672	82125212	objective-OR-neutral	I been watching "All-Access Kentucky" every wed and it has been making me like these young dudes on Kentucky.
263098506644955136	141049123	objective-OR-neutral	##$$## Black Friday Deals Nikon D3200 24.2 Megapixels Digital SLR Camera with 18-55mm NIKKOR VR Lens, Black & Nikon ... bit.ly/S9YhCg
228956189000597505	501134907	positive	Han mon dieu le remix de I am the best dans Dream High 2, je meurs XDDD
264203931645775873	27777925	objective	You do not want to miss this tomorrow night. RJ is moving to Maryland soon, and we have a truly epic set planned... fb.me/AMwhaYVv
260920467324555265	361434318	neutral	Don't forget Mitch Daniels is going to be on Steven Colbert's show Thursday. Think this will come up as a topic?
264127995424423936	62680567	neutral	@BarackObama: I would think you would do that if you are running for POTUS. It may be part of your job someday.
